{
  "id": "vac-acme-platform-engineer",
  "source": "site",
  "source_id": "acme-123",
  "url": "https://careers.example.com/jobs/acme-123",
  "company": "Acme Cloud",
  "title": "Senior Platform Engineer",
  "location": "Remote, EU",
  "remote": "remote",
  "salary_min": 95000,
  "salary_max": 120000,
  "currency": "EUR",
  "tags": ["platform", "observability", "kubernetes"],
  "jd_markdown_path": "memory/vacancies/vacancy-acme-platform-engineer.md",
  "match_score": 83,
  "match_rationale": "Strong overlap with platform, observability, and internal tooling work.",
  "status": "candidate",
  "first_seen_at": "2026-04-22T06:30:00Z"
}
